{
  "_generatedBegin": "BEGIN GENERATED AZ305 V1",
  "schemaVersion": "1.0.0",
  "labId": "LAB-14",
  "runId": "synthetic-140001",
  "track": "azure-cli",
  "implementationMode": "design-simulation",
  "status": "planned",
  "createdAt": "2026-09-02T00:00:00Z",
  "execute": true,
  "parameters": {
    "location": "westeurope",
    "secondaryLocation": "northeurope",
    "resourceGroup": "rg-az305-synthetic-140001"
  },
  "managedObjects": [],
  "originalSettings": []
  ,"_generatedEnd": "END GENERATED AZ305 V1"
}
